{
  "description": "Scene 01",
  "environment": {
    "background": [0, 0.0, 0],
    "ambient_light": [0.2, 0.2, 0.2],
    "camera_position": [0, 0, 10],
    "camera_target": [0, 0, 0],
    "shadows": true,
    "reflections": true,
    "refractions": true,
    "secondary_ray_eps": 0.0275
  },
  "point_lights": [
    {
      "position": [0, 80, 0],
      "intensity": [500.0, 500.0, 500.0]
    },
    {
      "position": [0, 5, 10],
      "intensity": [500.0, 500.0, 500.0]
    }
  ],
  "materials": [
    {
      "albedo": [0.3, 0.3, 0.3],
      "shine": 0,
      "specular": 0.0,
      "reflectivity": 0.1,
      "transparency": 0.0,
      "ior": 1
    },
    {
      "albedo": [1.0, 1.0, 0.0],
      "shine": 0.0,
      "specular": 0.0,
      "reflectivity": 0.0,
      "transparency": 0.0,
      "ior": 1
    },
    {
      "albedo": [0.0, 0.9, 0.9],
      "shine": 500.0,
      "specular": 0.1,
      "reflectivity": 0.2,
      "transparency": 0.0,
      "ior": 1
    },
    {
      "texture": "polka",
      "shine": 0.0,
      "specular": 0.0,
      "reflectivity": 0.0,
      "transparency": 0.0,
      "ior": 1
    },
    {
      "albedo": [0.5, 0.5, 0.5],
      "shine": 200.0,
      "specular": 0.0,
      "reflectivity": 0.0,
      "transparency": 0.8,
      "ior": 1.13
    },
    {
      "albedo": [0.1, 0.6, 0.1],
      "shine": 0.0,
      "specular": 0.0,
      "reflectivity": 0.0,
      "transparency": 0.0,
      "ior": 1
    }
  ],
  "root": {
    "children": [
      {
        "transforms": [
          { "type": "scale", "value": [50.0, 0.05, 50.0] },
          { "type": "translate", "value": [0, -5, 0] }
        ],
        "children": [
          {
            "mesh_id": "cube",
            "material_id": 0
          }
        ]
      },
      {
        "transforms": [
          { "type": "scale", "value": [13.0, 13.0, 11.0] },
          { "type": "rotate_y", "value": [0.5] },
          { "type": "rotate_x", "value": [1.3] },
          { "type": "translate", "value": [-3, 9, -18] }
        ],
        "children": [
          {
            "mesh_id": "torus",
            "material_id": 1
          }
        ]
      },
      {
        "transforms": [
          { "type": "scale", "value": [70.0, 70.0, 70.0] },
          { "type": "rotate_y", "value": [0.7]},
          { "type": "translate", "value": [-3, -2, -18] }
        ],
        "children": [
          {
            "mesh_id": "bunny",
            "material_id": 2
          }
        ]
      },
      {
        "transforms": [
          { "type": "scale", "value": [6.0, 6.0, 6.0] },
          { "type": "translate", "value": [9, -2, -16] }
        ],
        "children": [
          {
            "mesh_id": "sphere",
            "material_id": 3
          }
        ]
      },
      {
        "transforms": [
          { "type": "scale", "value": [2.0, 0.50, 0.10] },
          { "type": "rotate_x", "value": [0.2]},
          { "type": "rotate_y", "value": [-0.4]},
          { "type": "translate", "value": [1.0, -1.0, 6.8] }
        ],
        "children": [
          {
            "mesh_id": "cube",
            "material_id": 4
          }
        ]
      },
      {
        "transforms": [
          { "type": "scale", "value": [0.5, 2.0, 0.5] },
          { "type": "translate", "value": [2.5, -3.0, 3.5] }
        ],
        "children": [
          {
            "mesh_id": "cone",
            "material_id": 5
          }
        ]
      }

    ]
  }
}
